Book Id,Title,Author,Author l-f,Additional Authors,ISBN,ISBN13,My Rating,Average Rating,Publisher,Binding,Number of Pages,Year Published,Original Publication Year,Date Read,Date Added,Bookshelves,Bookshelves with positions,Exclusive Shelf,My Review,Spoiler,Private Notes,Read Count,Recommended For,Recommended By,Owned Copies,Original Purchase Date,Original Purchase Location,Condition,Condition Description,BCID
29889285,Campaign Finance: What Everyone Needs to Know,Robert E Mutch,"Mutch, Robert E",,0190274689,9780190274689,0,4.08,"Oxford University Press, USA",Paperback,240,2016,,,3/26/2020,to-read,to-read (#74),to-read,,,,0,,,0,,,,,
31670227,A Whirlwind Tour of Python,Jake Vanderplas,"Vanderplas, Jake",,,9781491964651,0,4.24,O'Reilly,ebook,98,2016,,,3/20/2020,currently-reading,currently-reading (#12),currently-reading,,,,1,,,0,,,,,
31138556,Homo Deus: A History of Tomorrow,Yuval Noah Harari,"Harari, Yuval Noah",,,,5,4.26,Harper,Kindle Edition,450,2017,2017,3/12/2020,4/3/2019,,,read,,,,1,,,0,,,,,
5040588,"The Magykal Papers (Septimus Heap, #7.5)",Angie Sage,"Sage, Angie",Mark Zug,0061704164,9780061704161,0,3.96,Katherine Tegen Books,Hardcover,167,2009,2009,12/25/2009,2/26/2020,,,read,,,,1,,,0,,,,,
7772,Dr. Seuss's Sleep Book,Dr. Seuss,"Seuss, Dr.",,0394800915,9780394800912,0,4.17, New York: Random House,Hardcover,58,2012,1962,,2/21/2020,,,read,,,,1,,,0,,,,,
19063,The Book Thief,Markus Zusak,"Zusak, Markus",,0375831002,9780375831003,4,4.37,Alfred A. Knopf,Hardcover,552,2006,2005,1/1/2012,8/31/2018,,,read,,,,1,,,0,,,,,
1617,Night  (The Night Trilogy #1),Elie Wiesel,"Wiesel, Elie","Marion Wiesel, François Mauriac",,,0,4.33,Hill & Wang,Paperback,115,2006,1956,,2/20/2020,,,read,,,,1,,,0,,,,,
480714,"Night of the Eye (Dragonlance: Defenders of Magic, #1)",Mary L. Kirchoff,"Kirchoff, Mary L.",,1560768401,9781560768401,0,3.78,Wizards of the Coast,Paperback,314,2005,1994,,2/20/2020,,,read,,,,1,,,0,,,,,
500555,"Quest for the Queen (The Secrets of Droon, #10)",Tony Abbott,"Abbott, Tony","David Merrell, Tim Jessell",0439207843,9780439207843,5,3.93,Scholastic Paperbacks,Paperback,112,2000,2000,1/1/2008,2/19/2020,,,read,,,,1,,,0,,,,,
176326,The Problem Child,Michael Buckley,"Buckley, Michael",Peter Ferguson,0810949148,9780810949140,4,4.28,Harry N. Abrams,Hardcover,320,2006,2006,1/1/2010,8/30/2018,,,read,,,,1,,,0,,,,,
661661,"Flight of the Genie (The Secrets of Droon, #21)",Tony Abbott,"Abbott, Tony",David Merrell,0439560438,9780439560436,5,3.94,Scholastic,Paperback,128,2004,2003,1/1/2008,2/19/2020,,,read,,,,1,,,0,,,,,
315738,"Dream Thief (The Secrets of Droon, #17)",Tony Abbott,"Abbott, Tony",David Merrell,0439420784,9780439420785,5,3.97,Scholastic Paperbacks,Paperback,128,2003,2003,1/1/2008,2/19/2020,,,read,,,,1,,,0,,,,,
902750,"The Mask of Maliban (The Secrets of Droon, #13)",Tony Abbott,"Abbott, Tony",Tim Jessell,043930606X,9780439306065,5,3.92,Scholastic Paperbacks,Paperback,128,2001,2001,1/1/2008,2/19/2020,,,read,,,,1,,,0,,,,,
1256165,"The Knights of Silversnow (The Secrets of Droon, #16)",Tony Abbott,"Abbott, Tony",,0439306094,9780439306096,5,3.96,Scholastic Paperbacks,Paperback,128,2002,2002,1/1/2008,2/19/2020,,,read,,,,1,,,0,,,,,
299798,"The Fortress of the Treasure Queen (The Secrets of Droon, #23)",Tony Abbott,"Abbott, Tony",David Merrell,0439661579,9780439661577,5,3.97,Scholastic Inc.,Mass Market Paperback,128,2004,2004,1/1/2008,2/19/2020,,,read,,,,1,,,0,,,,,
1202113,"Under the Serpent Sea (The Secrets of Droon, #12)",Tony Abbott,"Abbott, Tony",Tim Jessell,043920786X,9780439207867,5,3.92,Scholastic,Paperback,128,2001,2001,1/1/2008,2/19/2020,,,read,,,,1,,,0,,,,,
824972,"Search for the Dragon Ship (The Secrets Of Droon, #18)",Tony Abbott,"Abbott, Tony",,0439420792,9780439420792,5,3.94,Scholastic Paperbacks,Paperback,128,2003,2003,1/1/2008,2/19/2020,,,read,,,,1,,,0,,,,,
980548,"The Sleeping Giant of Goll (The Secrets of Droon, #6)",Tony Abbott,"Abbott, Tony",Tim Jessell,0590108441,9780590108447,5,3.95,Scholastic,Paperback,112,2000,2000,1/1/2008,2/19/2020,,,read,,,,1,,,0,,,,,
2049299,The Riddle Of Zorfendorf Castle (The Secrets Of Droon #25),Tony Abbott,"Abbott, Tony",,0439671736,9780439671736,5,4,Scholastic,Paperback,128,2005,2005,1/1/2008,2/19/2020,,,read,,,,1,,,0,,,,,
792225,"The Golden Wasp (The Secrets of Droon, #8)",Tony Abbott,"Abbott, Tony",Tim Jessell,0439182980,9780439182980,5,3.99,Scholastic,Paperback,112,2000,2000,1/1/2008,2/19/2020,,,read,,,,1,,,0,,,,,
340101,"The Moon Scroll (The Secrets Of Droon, #15)",Tony Abbott,"Abbott, Tony",Tim Jessell,0439306086,9780439306089,5,3.96,Scholastic Paperbacks,Paperback,144,2002,2002,1/1/2008,2/19/2020,,,read,,,,1,,,0,,,,,
287496,"In the Ice Caves of Krog (The Secrets of Droon, #20)",Tony Abbott,"Abbott, Tony",Gil Adams,0439560403,9780439560405,5,3.97,Scholastic Inc.,Paperback,128,2003,2003,1/1/2008,2/19/2020,,,read,,,,1,,,0,,,,,
323355,The Book of Mormon: Another Testament of Jesus Christ,Anonymous,"Anonymous, Anonymous",Joseph Smith Jr.,0967686563,9780967686561,4,4.36,The Church of Jesus Christ of Latter-day Saints,Paperback,531,2013,1830,1/1/2008,2/19/2020,,,read,,,,1,,,0,,,,,
340104,"The Mysterious Island (The Secrets of Droon, #3)",Tony Abbott,"Abbott, Tony","David Merrell, Tim Jessell",0590108409,9780590108409,5,3.85,Scholastic Paperbacks,Paperback,96,1999,1999,1/1/2008,2/19/2020,,,read,,,,1,,,0,,,,,
340106,"The Tower of the Elf King (The Secrets of Droon, #9)",Tony Abbott,"Abbott, Tony","David Merrell, Tim Jessell",043920772X,9780439207720,5,3.88,Scholastic,Paperback,112,2000,2000,1/1/2008,2/19/2020,,,read,,,,1,,,0,,,,,
1061385,"The Isle of Mists (The Secrets of Droon, #22)",Tony Abbott,"Abbott, Tony",,0439560489,9780439560481,5,3.98,Scholastic,Paperback,128,2004,2004,1/1/2008,2/19/2020,,,read,,,,1,,,0,,,,,
1061388,"The Hidden Stairs and the Magic Carpet (The Secrets of Droon, #1)",Tony Abbott,"Abbott, Tony",Tim Jessell,0590108395,9780590108393,5,3.86,Scholastic Paperbacks,Paperback,81,1999,1999,1/1/2008,2/19/2020,,,read,,,,1,,,0,,,,,
1061387,"The Race to Doobesh (The Secrets of Droon, #24)",Tony Abbott,"Abbott, Tony",,0439661587,9780439661584,5,4.03,Scholastic,Mass Market Paperback,144,2005,2004,1/1/2008,2/19/2020,,,read,,,,1,,,0,,,,,
340105,"The Hawk Bandits of Tarkoom (The Secrets of Droon, #11)",Tony Abbott,"Abbott, Tony",Tim Jessell,0439207851,9780439207850,5,3.91,Scholastic Paperbacks,Mass Market Paperback,128,2001,2001,1/1/2008,2/19/2020,,,read,,,,1,,,0,,,,,
689899,"The Great Ice Battle (The Secrets of Droon, #5)",Tony Abbott,"Abbott, Tony",Tim Jessell,0590108433,9780590108430,5,3.91,Scholastic Paperbacks,Paperback,96,1999,1999,1/1/2008,2/19/2020,,,read,,,,1,,,0,,,,,
1390916,"The Coiled Viper (The Secrets of Droon, #19)",Tony Abbott,"Abbott, Tony",Tim Jessell,0439420806,9780439420808,5,4.01,Scholastic Paperbacks,Paperback,128,2003,2003,1/1/2008,2/19/2020,,,read,,,,1,,,0,,,,,
825334,"City in the Clouds (The Secrets of Droon, #4)",Tony Abbott,"Abbott, Tony",Tim Jessell,0590108425,9780590108423,5,3.88,Scholastic,Paperback,96,1999,1999,1/1/2008,2/19/2020,,,read,,,,1,,,0,,,,,
1691409,"Journey to the Volcano Palace (The Secrets of Droon, #2)",Tony Abbott,"Abbott, Tony","David Merrell, Tim Jessell",0590108417,9780590108416,5,3.93,Scholastic,Paperback,87,1999,1999,1/1/2008,2/19/2020,,,read,,,,1,,,0,,,,,
1145236,The Guns of Tortuga,Brad Strickland,"Strickland, Brad",Thomas E. Fuller,0689852975,9780689852978,5,4,Aladdin,Paperback,208,2003,2003,1/1/2009,2/19/2020,,,read,,,,1,,,0,,,,,
3276072,Scat,Carl Hiaasen,"Hiaasen, Carl",,0375834869,9780375834868,4,3.95,Alfred A. Knopf Books for Young Readers,Hardcover,384,2009,2009,1/1/2009,2/19/2020,,,read,,,,1,,,0,,,,,
13083,Hoot,Carl Hiaasen,"Hiaasen, Carl",,0440421705,9780440421702,4,3.82,Yearling Books,Paperback,292,2006,2002,1/1/2009,2/19/2020,,,read,,,,1,,,0,,,,,
2195510,Mutiny!,Brad Strickland,"Strickland, Brad",,0689852967,9780689852961,5,3.74,Aladdin Paperbacks,Paperback,191,2002,2002,1/1/2009,2/19/2020,,,read,,,,1,,,0,,,,,
9520360,"The Son of Neptune (The Heroes of Olympus, #2)",Rick Riordan,"Riordan, Rick",,1423140591,9781423140597,5,4.44,Disney-Hyperion Books,Hardcover,521,2011,2011,1/1/2011,2/17/2020,,,read,,,,1,,,0,,,,,
29396,"Furies of Calderon (Codex Alera, #1)",Jim Butcher,"Butcher, Jim",,044101268X,9780441012688,5,4.12,Ace,Paperback,504,2005,2004,1/1/2011,2/16/2020,,,read,,,,1,,,0,,,,,
12127750,"The Mark of Athena (The Heroes of Olympus, #3)",Rick Riordan,"Riordan, Rick",,1423140605,9781423140603,5,4.46,Disney-Hyperion Books,Hardcover,586,2012,2012,1/1/2012,2/17/2020,,,read,,,,1,,,0,,,,,
1885,Pride and Prejudice,Jane Austen,"Austen, Jane",Anna Quindlen,,,4,4.26,Modern Library,Paperback,279,2000,1813,1/1/2012,11/7/2017,,,read,,,,1,,,0,,,,,
140963,"O Pioneers! (Great Plains Trilogy, #1)",Willa Cather,"Cather, Willa",,0679743626,9780679743620,3,3.87,Vintage,Paperback,159,1992,1913,1/1/2012,2/18/2020,,,read,,,,1,,,0,,,,,
18135,Romeo and Juliet,William Shakespeare,"Shakespeare, William","Paul Werstine, Barbara A. Mowat",0743477111,9780743477116,4,3.74,Simon Schuster,Paperback,368,2004,1595,1/1/2014,11/7/2017,,,read,,,,1,,,0,,,,,
12609433,The Power of Habit: Why We Do What We Do in Life and Business,Charles Duhigg,"Duhigg, Charles",,1400069289,9781400069286,5,4.1,Random House,Hardcover,375,2012,2012,1/1/2016,11/7/2017,,,read,,,,1,,,0,,,,,
998,The Millionaire Next Door: The Surprising Secrets of America's Wealthy,Thomas J. Stanley,"Stanley, Thomas J.",William D. Danko,0671015206,9780671015206,5,4.03,Gallery Books,Paperback,258,1998,1995,1/1/2016,11/7/2017,,,read,,,,1,,,0,,,,,
141565,This Is Your Brain on Music: The Science of a Human Obsession,Daniel J. Levitin,"Levitin, Daniel J.",,0525949690,9780525949695,5,3.87,Dutton Adult,Hardcover,314,2006,2006,1/1/2017,11/7/2017,,,read,,,,1,,,0,,,,,
15014,Crucial Conversations: Tools for Talking When Stakes Are High,Kerry Patterson,"Patterson, Kerry","Joseph Grenny, Ron McMillan, Al Switzler, Stephen R. Covey",0071401946,9780071401944,4,4.03,McGraw-Hill Education,Paperback,240,2002,2001,,11/7/2017,,,read,,,,1,,,0,,,,,
28257707,The Subtle Art of Not Giving a F*ck: A Counterintuitive Approach to Living a Good Life,Mark Manson,"Manson, Mark",,,,4,3.96,Harper,ebook,224,2016,2016,1/1/2019,10/13/2019,,,read,,,,1,,,0,,,,,
1052,The Richest Man in Babylon,George S. Clason,"Clason, George S.",,0451205367,9780451205360,5,4.26,Berkley Books,Paperback,194,2008,1926,3/24/2019,8/31/2018,,,read,,,,1,,,0,,,,,
